,company,country,description,location,review,salary,star,title
4,Citi,Malaysia,"Reviewing Analysts' recommendations for further enquiry, escalation or closure. Accurately gather, maintain and utilize data in various product databases for...",Kuala Lumpur,11052,,44.4,Operations Support Intermediate Analyst
5,AIG,Malaysia,"O Managing databases, verifying data integrity and providing SQL administration. Bachelor degree in Computer Science, Engineering/Software or related subject....",Cyberjaya,2126,,43.8,IT Tech Analyst III
6,Citi,Malaysia,"Experience translating solutions to business requirements and/or demonstrated data analysis skills. Malaysia,Wilayah Persekutuan,Kuala Lumpur....",Kuala Lumpur,11052,,44.4,MYS CTSM KL - Operations Support Sr. Analyst
7,AIG,Malaysia,"Identify and support opportunities to improve and streamline processes regarding data flow and data quality to improve data accuracy, completeness and value....",Kuala Lumpur,2126,,43.8,Senior Business Intelligence Analyst
8,IHS Markit,Malaysia,Complete basin and data driven projects which are set out in conjunction with the regional teams and central data group....,Petaling Jaya,143,,43.2,Sr Technical Research I
9,Citi,Malaysia,"Primary Location: Malaysia,Wilayah Persekutuan,Kuala Lumpur Education: Bachelor's Degree Job Function: Operations Schedule: Full-time Shift: Day Job Employee...",Kuala Lumpur,11052,,44.4,MYS CTSM KL - AML M&I Data Intelligence Data Miner – Global Task Force
0,Fave Group Pte Ltd,Malaysia,"Proven leadership running teams of data scientists, analysts, engineers. Helping to streamline the collection and analysis of data from across multiple data...",Kuala Lumpur,,,,Head of Data Science - KL
1,KFit,Malaysia,"Proven leadership running teams of data scientists, analysts, engineers. Helping to streamline the collection and analysis of data from across multiple data...",Kuala Lumpur,,,,Head of Data Science - KL
2,Huntsman,Malaysia,"Ensures enforcement of security policies and procedures across data center, networks, databases, and applications layers....",Kuala Lumpur,263,,44.4,IT Security Operation Analyst (12 months contract)
3,Citi,Malaysia,Performing peer review of investigations to ensure appropriate disposition was recommended by analyst....,Kuala Lumpur,11052,,44.4,MYS CTSM KL - AML Operations Analyst
4,Citi,Malaysia,AML Operations Analyst. Demonstrated ability to perform detailed analysis of raw data based on policy and work instructions....,Kuala Lumpur,11052,,44.4,MYS CTSM KL - AML Sanctions Screening Operations Analyst
5,Citi,Malaysia,"Specific experience in Securities related functions e.g. Corporate Actions / Asset Servicing, Settlement, SWIFT message and Data Maintenance, Account opening,...",Kuala Lumpur,11052,,44.4,MYS CTSM KL - Associate Customer Service Analyst
6,Petrofac,Malaysia,"Of system analyst. Ensure cost effective IT and data managements. Work with PETRONAS Data Management divisions, Joint-Venture Partners and....",Kuala Lumpur,158,,51.6,Data Manager
7,Marsh,Malaysia,Ensuring client data submission and quality by working together with the team. The Senior Analyst actions and supports the survey responsibilities according to...,Kuala Lumpur,139,,43.2,Senior Analyst
8,Willis Towers Watson,Malaysia,"Able to draw conclusions from data in a logical, systematic way. As a Senior Analyst, you will work beside some of the industry’s top consultants while you...",Kuala Lumpur,455,,44.4,Senior Analyst
0,Kimberly-Clark,Malaysia,"SharePoint (for data consumption/deployment). ITS Analytics Designer - Business Analyst. Experience collaborating with Business Analysts, Solution Architects...",Petaling Jaya,882,,51.0,ITS Analytics Designer - Business Analyst
1,Teradata,Malaysia,"With a powerful combination of Industry expertise and leading hybrid cloud technologies for data warehousing and big data analytics, Teradata unleashes the...",Kuala Lumpur,105,,44.4,Field Enablement
2,DXC Technology,Malaysia,Assist GSOC Analysts with issues or questions that may arise during investigations. GSOC Customer Liaison / Incident Lead · Assist GSOC analyst and shift leads...,Cyberjaya,807,,42.0,Japanese Speaking IT Security Consultant
3,Agensi Pekerjaan Symphony Search Sdn Bhd,Malaysia,"Coordinate and Manage the Technical Solution Analyst to ensure completeness and quality assurance. Knowledge in Cloud Computing, Big Data, Enterprise Service...",Petaling Jaya,,,,Technical Solution Manager
4,SANDOZ,Malaysia,"Consolidate, evaluate and propose expected macroeconomic data and trends. Interpret key data (key business drivers, KPIs, business metrics) and translate them...",Petaling Jaya,382,,44.4,Business Planning & Analyst Manager
5,Infiniti Ltd,Malaysia,"Work closely with strategists, traders, analysts to transform ideas into algorithmic trading strategies in a fast paced team environment....",Kuala Lumpur,,,,Algorithmic Trading Strategy Developer / Programmer
6,UCSI University,Malaysia,"Able to consolidate data into meaningful information. To co-deliver highly impactful Consulting/Training engagements for clients using the systematic tools,...",Kuala Lumpur,13,,43.2,"Senior Analyst - Strategy, Innovation & Management"
7,Experian,Malaysia,Supervise two data quality analysts based in Cyberjaya. Cross-functional data and reporting alignment. Acquisition integration and data migration projects....,Cyberjaya,672,,42.6,Finance Senior Data Quality Specialist
8,TGS & Partners (M) Sdn Bhd,Malaysia,Provide monthly cost analyst and recommend measures if necessary. Must be able to analyst the accounts and prepare reconciliation statements....,Kuala Lumpur,,,,Account Executive
9,Networkers,Malaysia,Develop the data model describing key data elements and how they are to be used. Review applications developed by programmers and analysts to ensure...,Bangsar,10,,51.0,Database Administrator (DB2)
0,AIG,Malaysia,Work closely with business intelligence analysts to ensure business requirements are adequately translated into data requirements within AxonMart....,Kuala Lumpur,2126,,43.8,Senior Portfolio Analyst
1,McKinsey & Company,Malaysia,"Strong ability to use data effectively to influence change. As Senior Category Lead, you're responsible for managing spend on a regional basis and developing...",Kuala Lumpur,293,,52.8,Senior Category Lead
2,IBM,Malaysia,"Data analysis skills (Excel). CAMS includes practice teams in cloud application development, cloud advisory, big data, security and complex systems architecture...",Petaling Jaya,18061,,51.0,Digital Banking Senior Business Analyst (GBS CAMS Asean)
3,Deloitte,Malaysia,Seniors would be required to support junior data analysts in resolving data quality or integrity issues within their own datasets....,Kuala Lumpur,5329,,51.0,Audit Analytics Senior Associate
4,GlaxoSmithKline,Malaysia,Ability to successfully analyse large volumes of data. You are a passionate Senior Planning Hub Analyst with the following attributes:....,Petaling Jaya,2532,,52.2,Senior Planning Hub Analyst-1
5,Lazada,Malaysia,"In order to succeed in the role, you should ideally have: Bachelor degree or Diploma in a related field (Data science and actuarial science preferred)....",Kuala Lumpur,103,,43.8,Senior Associate Platform Operation Analyst
6,BAE Systems Applied Intelligence,Malaysia,Developing and maintaining threat data sources. The Senior Threat Intel Analyst is technical specialist with an analytical mind and an eye for detail who can...,Kuala Lumpur,34,,43.2,Senior Threat Intel Analyst
7,McDermott,Malaysia,Coordinate and ensure completeness and correctness of data load to Hyperion Financial Management system for forecast data....,Kuala Lumpur,87,,43.8,Senior FP&A Analyst
8,McKinsey & Company,Malaysia,"Basic familiarity with data visualization tools such as Tableau and/or PowerBI. Advanced degree in Computer Applications, Engineering, Mathematics or Operations...",Kuala Lumpur,293,,52.8,Senior Knowledge Analyst - Recovery & Transformation Services
9,Expert Integrators - EXI,Malaysia,System Analyst II. Record to Report Analyst. SAP CRM ABAP Analyst (Contract). Knowledge of data warehousing and database concept....,Kuala Lumpur,,,,SAP Helpdesk Analyst
0,Agensi Pekerjaan The Recruiter Sdn Bhd,Malaysia,"Manufacturing system experience required for Radius Analyst role. Perform data analysis and application development, including minor programming, to support...",Kuala Lumpur,,,,Business Systems Analyst
2,Pasona Malaysia,Malaysia,❖To analyse credit data and financial statements to determine the degree of risk involved in extending credit or lending money....,Kuala Lumpur,8,,43.8,Credit Analyst - Corporate Banking Industry
3,EPS Malaysia,Malaysia,"Troubleshoot issues with invoices processing, shopping carts, purchase orders and vendor master data. US-Based MNC Pharmaceutical Company....",Kuala Lumpur,,,,Purchasing Analyst
4,Shell,Malaysia,"The Analyst is accountable for:. Compile supplementary data on volume, tax, cash, commitment and etc. Reporting & Analysis support....",Cyberjaya,2968,,44.4,R&A Finance Analyst
5,ResMed,Malaysia,"Ability to define problems, collect data, establish facts, and draw valid conclusions. Work closely with other teams, such as but not limited to,development...",Kuala Lumpur,61,,43.8,Technical Software Support
6,Micro Focus,Malaysia,"Gathers financial data and performs financial analyses and reporting (e.g., profit & loss, balance sheet, cash flow, pricing, etc.)....",Kuala Lumpur,100,,44.4,Financial Analyst (Japanese-Speaking)
7,BAT Aspac Service Centre Sdn Bhd,Malaysia,"Exposure Data Integrity . Create, manage, organize and interpret data; 2.Monitor, observe and test system to determine data and/or application problems;...",Kuala Lumpur,,,,Senior Analyst-Data Integrity
8,STS - AIS,Malaysia,"Evaluate machinery condition by understanding vibration data, machine performance, operational and maintenance data and direct communication with the operator....",Kuala Lumpur,,,,Senior Engineer / Analyst
0,Lazada,Malaysia,"As the pioneer of the eCommerce ecosystem in Southeast Asia, Lazada helps more than 80,000 local and international sellers, as well as 2,500 brands, serve the...",Kuala Lumpur,103,,43.8,Senior Analyst Account Receivable
1,Graduan.com.my,Malaysia,"Operate an incident escalation frame-work, taking ownership of market data incidences and managing them to conclusion....",Kuala Lumpur,,,,Operation Analyst - Unix
2,Medtronic,Malaysia,Knowledge of big data and techniques of data mining. Handling Business Analyst Profile in a Consultancy firm....,Petaling Jaya,1274,,51.0,Sr Business Intelligence Analyst
3,Citi,Malaysia,"Specific experience in Securities related functions eg Corporate Actions/Asset Servicing, Settlement, SWIFT message & Data Maintenance, Account Opening, Custody...",Kuala Lumpur,11052,,44.4,MYS CTSM KL - Custody Operations Analyst - Assistant Manager (SFE)
4,Citi,Malaysia,"Specific experience in Securities related functions eg Corporate Actions/Asset Servicing, Settlement, SWIFT message & Data Maintenance, Account Opening, Custody...",Kuala Lumpur,11052,,44.4,MYS CTSM KL - Custody Operations Analyst - Assistant Manager
5,Comarch,Malaysia,Work closely with Comarch Data Center team to maintain services in accordance to Service Level Agreement....,Kuala Lumpur,5,,43.8,Junior System Engineer
6,AIA,Malaysia,"Forensic Analyst (GCFA). Detailed understanding of big data analytics. Hunt for threat actors’ techniques, tools and processes, which may potentially target the...",Cyberjaya,2,,60.0,Manager Measurement & Reporting CyberSecurity
7,Micro Focus,Malaysia,"Provides mentoring and guidance to analysts. Typically 6+ years of experience as a financial analyst. Leads business initiatives, typically leading analysts...",Kuala Lumpur,100,,44.4,Compliance & Pricing Analyst
8,Lazada,Malaysia,"As the pioneer of the eCommerce ecosystem in Southeast Asia, Lazada helps more than 80,000 local and international sellers, as well as 2,500 brands, serve the...",Kuala Lumpur,103,,43.8,Analyst / Senior Analyst Accounts Payable
9,Oracle,Malaysia,"Enterprise database, data warehouse and broad experience in IT systems and. Oracle is rapidly transforming itself....",Kuala Lumpur,3080,,44.4,IAAS Presales Consultant - MY
0,McKinsey & Company,Malaysia,"As one of the fastest-growing parts of the our firm, New Ventures has more than 1,500 dedicated professionals (including more than 800 analysts and data...",Kuala Lumpur,293,,52.8,Client Development Manager - Panorama
1,Exxon Mobil,Malaysia,"Perform financial analysis with Global Data Warehouse to ensure data integrity. Tax, Financial, ERP, Financial Analyst, SAP, Finance, Technology....",Kuala Lumpur,1434,,51.0,ExxonMobil IT BAR Analyst (Business/Finance)
2,ExxonMobil,Malaysia,Perform financial analysis with Global Data Warehouse to ensure data integrity. Job Role Summary....,Kuala Lumpur,1434,,51.0,ExxonMobil IT BAR Analyst (Business/Finance)
3,Data Matriqs Sdn Bhd,Malaysia,"Differences across a variety of developers, analysts, and business clients. Thorough understanding of both client and web application development....",Kuala Lumpur,,,,Node JS Developer
6,,Malaysia,Client Finance Analyst | Kepong | Max RM5000. Junior Financial Analyst | Shah Alam | RM 4000 - RM 5000....,Kuala Lumpur,,,,Senior Accounts - Shah Alam / Kelana Jaya / Kepong
7,AIA,Malaysia,Help perform data migration and ensure its successful. Review & validate solution and development work delivered by System Analyst....,Cyberjaya,2,,60.0,"Manager - ABAP, SAPCOE"
8,AIA,Malaysia,"Forensic Analyst (GCFA). Detailed understanding of big data analytics. Hunt for threat actors’ techniques, tools and processes, which may potentially target the...",Cyberjaya,2,,60.0,Manager Threat Hunting
0,Expert Integrators - EXI,Malaysia,System Analyst II. Record to Report Analyst. SAP CRM ABAP Analyst (Contract). Knowledge of data warehousing and database concept....,Kuala Lumpur,,,,Purchasing Executive
1,Avanade,Malaysia,Problem solving in identifying problems on systems with data gathering and analysis and provide technical solutions....,Kuala Lumpur,118,,43.8,"Senior Analyst, Digital Solution Development"
2,Michael Page,Malaysia,Data mining using state-of-the-art methods. Suggest new ways to look at data. The Business Data Scientist portfolio will include setting a standard in obtaining...,Kuala Lumpur,157,,42.0,Data Science / Data Analyst
3,Michael Page,Malaysia,"Data collection and validation. Due to company growth, our client is seeking 3 Data Analysts, within this key role, major responsibilities will include:....",Kuala Lumpur,157,,42.0,Data Analyst - Italian Speaking
4,BASF Asia Pacific,Malaysia,"Request the creation and maintenance of vendor master data in SAP, support Master Data Team (if applicable). Kuala Lumpur, MY, 50000....",Kuala Lumpur,2,,54.0,"Analyst, Procurement Services (Chinese Literate)"
5,Michael Page,Malaysia,"Prepares and administers various management reports, including collecting and analyzing data and producing performance dashboards....",Cyberjaya,157,,42.0,Head of Business Operations - Fortune 500 Technology MNC
6,Michael Page,Malaysia,"Write thorough reports on billing activity with clear and reliable data. Remuneration Package ranging from RM3,000 - RM4,000, depending on experience....",Kuala Lumpur,157,,42.0,Billing Analyst
8,Roche,Malaysia,"Experience with structured and unstructured data (NLP, text processing). Experience with developing with open source technologies such as Cloudera / SolR...",Kuala Lumpur,860,,52.2,FPP Sr IT Professional - Solution Architect
9,EPS Malaysia,Malaysia,"Prepare accurate HR data for travel profiles creation, modification, deletion and analyze HRi data for discrepancies....",Kuala Lumpur,,,,Online & Training Support Analyst
0,Deloitte,Malaysia,Responsible for SEA country monthly financial results and ensure completeness and data quality. Lead forecasting and planning processes including developing...,Kuala Lumpur,5329,,51.0,Financial Analyst Manager (SEA Finance)
1,GlaxoSmithKline,Malaysia,Work with the Business and Data Subject Matter Experts to define the data quality metrics & parameters for the relevant data elements....,Klang,2532,,52.2,SME P2P (Purchase to Procure)
2,EPS Malaysia,Malaysia,"Equity Analyst, Investment. Develop and implement data collection systems and other strategies that optimized statistical efficiency and data quality....",Bukit Bintang,,,,"Equity Analyst, Investment"
3,BAT Aspac Service Centre Sdn Bhd,Malaysia,"Functionalities and data; The Senior Reporting Services Analyst will support the preparation of the statutory and management accounting reporting process, and...",Kuala Lumpur,,,,Senior Analyst- Planning & Reporting
4,Expert Integrators - EXI,Malaysia,System Analyst II. Record to Report Analyst. SAP CRM ABAP Analyst (Contract). Knowledge of data warehousing and database concept....,Kuala Lumpur,,,,Quantity Surveyor (2 positions available)
5,KPMG,Malaysia,Contribute technically to Data and Analytics initiatives. Minimum of 5 years working experience as an IT auditor / IT analyst / IT consultant in a professional...,Petaling Jaya,3631,,51.0,Manager / Senior Manager – Information Risk Management (IRM) Specialist
6,"E2open, Inc.",Malaysia,O Analyze data in MS Excel as needed. Willingness to ‘dig in’ to data and figure out where discrepancies lie....,Kuala Lumpur,8,,43.8,Sr Business Analyst
7,British American Tobacco (Malaysia) Berhad,Malaysia,To support Trade functions by delivering comprehensive reports and identification of opportunities for data exploitation and usage....,Kuala Lumpur,658,,52.2,Distribution Development Analyst
8,Hong Leong Islamic Bank - MY,Malaysia,"Oracle Data Integrator (ODI), Informatica); Knowledge in Enterprise Data Warehouse architecture & capabilities, BI reporting tools and information management...",Kuala Lumpur,,,,"Senior Executive, Business Intelligence, IT Application (Analyst)"
9,Qapture Analytics Sdn Bhd,Malaysia,"Take responsibility for identifying information sources, gathering and interpreting data, and presenting findings to clients....",Petaling Jaya,,,,Marketing & Operational Executive
0,EPS Malaysia,Malaysia,"Generates and compiles data based on interactions with the business teams. Works with Internal customers, gathers and analyzes appreciate data to develop...",Cyberjaya,,,,IT Systems Analyst
1,Citi,Malaysia,"Conducting searches, gathering data and recording evidence from internal systems, the internet, commercial databases and enquiry with business or Compliance...",Kuala Lumpur,11052,,44.4,MYS CTSM KL - KYC Risk Evaluation Senior Analyst
2,Experian,Malaysia,"Identify causes of software problems (at product or data level). Carry out the extraction, formulation and manipulation of data to address business requirement....",Cyberjaya,672,,42.6,Business Support & Optimisation Senior Analyst
3,DELL,Malaysia,Ability to perform all types of data and instance recoveries under various scenarios. Why Work at Dell?...,Cyberjaya,5898,,51.0,"Sr Analyst, IT Service Ops"
4,Agensi Pekerjaan The Recruiter Sdn Bhd,Malaysia,"Manufacturing system experience required for Radius Analyst role. Perform data analysis and application development, including minor programming, to support...",Kuala Lumpur,,,,Business Systems Analyst at Kepong SAP Accounting System
5,Graduan.com.my,Malaysia,A Business Analyst is responsible for problem solving and analyzing data which will be presented to the project team and the client in order to shed light on a...,Kuala Lumpur,,,,Business Analyst
6,Citi,Malaysia,"Reviewing Analysts' recommendations for further enquiry, escalation or closure. Accurately gather, maintain and utilize data in various product databases for...",Kuala Lumpur,11052,,44.4,MYS CTSM KL - Operations Support Intermediate Analyst
7,DELL,Malaysia,"IT Controls frameworks (COBIT and ISO 27000) Payment Card Industry Data Security Standard, Sarbanes-Oxley Act as well as Data Privacy & Protection regulations....",Cyberjaya,5898,,51.0,"Sr Advisor, IT Security"
8,Expert Integrators - EXI,Malaysia,System Analyst II. Record to Report Analyst. SAP CRM ABAP Analyst (Contract). Knowledge of data warehousing and database concept....,Kuala Lumpur,,,,Record to Report Analyst
9,YNH Property,Malaysia,"Review and analysing project background data and reports with respect to contract issues, i.e. claims, change orders, schedule reports, delays analysis,...",Kuala Lumpur,,,,Management Associate Program
0,Six Degree Consulting,Malaysia,Conduct consumer research and analyse the data. Generate Eye tracking /market research report through own research and data given....,Puchong,,,,Client Account Executive (Market Consultant)
1,EY,Malaysia,Assessing and improving current processes and data flow surrounding existing IT tools. Proven experience helping organizations design or implement effective...,Kuala Lumpur,3885,,51.0,"Tax Technology, Senior IT Business Analyst"
2,Avanade,Malaysia,"Strong understanding of the latest technology trends and disruptor – Cloud, Mobile, Social, Big Data, Cyber Security, etc....",Kuala Lumpur,118,,43.8,"Manager, Solution Architect"
3,McKinsey & Company,Malaysia,"As one of the fastest-growing parts of our firm, New Ventures has more than 1,000 dedicated professionals (including more than 800 analysts and data scientists)...",Kuala Lumpur,293,,52.8,"Specialist - Diligence & Business Intelligence, Energy Insights"
5,AstraZeneca,Malaysia,"Address data quality issues such as remapping of General Ledger categories, operational and financial data reconciliation....",Petaling Jaya,1188,,51.6,SS4G Senior Analyst
6,"Amdocs, Inc.",Malaysia,"You will interface and work with business analysts and information system focal points. Provide standard and ad-hoc analysis, reporting business related...",Kuala Lumpur,697,,44.4,Business Operations Professional
7,Redmarch,Malaysia,Assisting in data analysis and reporting for various projects. Assisting in primary and secondary research for various projects across South East Asia....,Petaling Jaya,,,,Internship of Market Analyst Assistant
8,Deloitte,Malaysia,Knowledge of data tools (e.g. Build local member firm’s brand eminence in data analytics with go-to-market activities such as presentation at events relating to...,Kuala Lumpur,5329,,51.0,Audit Analytics Manager
0,Techsap ASP,Malaysia,"Responsible for certain closing activities and financial analysis (verifying financial data, making appropriate adjustments etc.)....",Cyberjaya,,,,Account and Finance Analyst
1,Expert Integrators - EXI,Malaysia,System Analyst II. Record to Report Analyst. SAP CRM ABAP Analyst (Contract). Knowledge of data warehousing and database concept....,Kuala Lumpur,,,,Senior SAP HR Consultant (Project)
2,Michael Page,Malaysia,"A great analyst role with an established MNC. Provide recommendations and set master data in SAP such as Safety Stocks, Min Lot Size, MRP types, Re-order Point....",Shah Alam,157,,42.0,Senior Inventory Analyst
3,AS White Global,Malaysia,"Bachelor’s Degree with at least 5 years of Business Analyst experience. Extensive practical knowledge in importing data for use in report software, spreadsheets...",Kuala Lumpur,,,,Business Analyst in Malaysia
4,Kimberly-Clark,Malaysia,"Analytical and data maintenance skills. Sound knowledge of company's business and internal processes, specifically data maintenance and Purchasing's operations....",Kuala Lumpur,882,,51.0,Procurement Analyst -P2P Management (Korean Speaking)
5,BASF Asia Pacific,Malaysia,"Evaluation of product data and perform related maintenance in system. Environment, Health & Safety....",Kuala Lumpur,2,,54.0,"Senior Analyst, Chemical Regulations"
6,Mercer,Malaysia,Ensuring client data submission and quality by working together with the team. The Senior Analyst actions and supports the survey responsibilities according to...,Kuala Lumpur,801,,42.6,Senior Analyst
7,Fullrich Malaysia,Malaysia,"Passionate in research and consulting, data collection and analysis work; Preferably engaged in an analyst or related position in Financial or IT related field...",Cyberjaya,,,,Marketing Executive
8,Shell,Malaysia,"Coach Customers on how to use the Shell Lubes Analyst systems when recording new machines and oil samples. Own the end to end Disputes process for Quantity,...",Kuala Lumpur,2968,,44.4,COS - Order To Cash
0,BASF Asia Pacific,Malaysia,"Perform and analyze booking of accountingtransactions, master data maintenance, workings and account analysis. Finance/Accounting/Controlling/Audit....",Kuala Lumpur,2,,54.0,"Analyst, Financial Reporting (Mandarin speaking)"
1,BASF Asia Pacific,Malaysia,"To support and back up other analyst in performing Management Accounting tasks as required. To maintain and ensure master data regarding material ledger,...",Kuala Lumpur,2,,54.0,"Senior Analyst, Management Accounting (Mandarin literate)"
2,Techsap ASP,Malaysia,"The role of Analyst will be to ensure that all reporting activities & responsibilities are performed in an accurate, timely and efficient manner....",Cyberjaya,,,,Accounting Analyst
3,Singtel,Malaysia,The group provides support and delivery of ICT services to a wide range of external clients in the Australian market who may have infrastructure located in...,Kuala Lumpur,152,,43.8,"Manager, Technical Assistance Centre (Network & Security)"
4,BP,Malaysia,Exposure to data entry and data analysis. Provide backup to Trade Investment Analyst in month end reporting requirements....,Kuala Lumpur,1951,,51.0,Trade Loan Senior Executive
5,JAC Malaysia,Malaysia,"Troubleshoot issues with shopping carts processing, purchase orders and vendor master data. Assist manager in managing P2P daily operations and escalate any...",Petaling Jaya,,,,SENIOR ANALYST - P2P
6,BAT Aspac Service Centre Sdn Bhd,Malaysia,Able to translate data analytics into commercial insights. Able to guide and mentor a team of reporting analysts....,Kuala Lumpur,,,,Reward & Benefits Manager
