,company,country,description,location,review,salary,star,title
2,BP,Malaysia,The Trade Loan Analyst reports as per the escalation matrix if any discrepancy in the data or process GAP may be identified....,Kuala Lumpur,1951,,51.0,Trade Loan Analyst
3,BHP Billiton,Malaysia,Payroll and Data Analyst. Payroll and Data Administrator. Highly accurate data entry skills. Uploads Master data into HR system....,Kuala Lumpur,550,,51.6,Administrator HR Data Management
4,Citi,Malaysia,Data manipulation and analysis Working knowledge of the. In-depth investigation into extracted data to support business initiatives....,Kuala Lumpur,11052,,44.4,Citibank Berhad KL – MIS Analyst Officer
5,Aimia,Malaysia,Love data and deep dive exploratory analysis. Quantitative and comfortable working with large amounts of data....,Kuala Lumpur,74,,42.6,Insights Analyst
6,WorleyParsons,Malaysia,"Responsible for issue resolution, data analysis and customer complaints through working with vendors, other teams and location stakeholders....",Kuala Lumpur,1167,,44.4,Payroll Analyst
7,BAE Systems Applied Intelligence,Malaysia,The Threat Analyst is responsible for collecting and maintaining threat data from open and closed sources to build a picture of threats groups that are relevant...,Kuala Lumpur,34,,43.2,Threat Intel Analyst
8,U Mobile,Malaysia,Work with Data Analytics team to draw insight from campaign results; Act as key business partner and advisor for Marketing Division to ensure data driven based...,Kuala Lumpur,4,,43.8,SE - Product Analyst
9,MPH Global Services,Malaysia,Analyst FP & AIndustry :. Proficient excel skill is desired to run multiple-level of data presentation. Management accounting and reporting Proficient in excel...,Kuala Lumpur,,,,Analyst FP & A
0,Starweb,Malaysia,"Monitors, maintains, and troubleshoots data or voice networks and responds to messages, alarms, or problems identified by tools....",Kuala Lumpur,,,,Network Analyst
1,QuintilesIMS,Malaysia,"Our people are analysts, statisticians, software engineers, consultants, sales leaders, marketing and product managers, and more....",Kuala Lumpur,913,,44.4,Analyst (Management Consulting) based in Malaysia
2,AIG,Malaysia,Sourcing external data for competitive insights of competitors’ products & strategies and market comparison....,Kuala Lumpur,2126,,43.8,Market Analyst
3,Networkers,Malaysia,"Serve as an open source Cyber threat intelligence analyst. Responsible for Level 2 / Level 3 Alert Reviewing and Investigation, when Security Analysts identify...",Cyberjaya,10,,51.0,Cyber Threat and Intelligence Analyst
4,Experian,Malaysia,"We are the leading global information services company, providing data and analytical tools to our clients around the world. Experian (M) Sdn Bhd....",Cyberjaya,672,,42.6,Technical Analyst
5,Epicor,Malaysia,Backing up and restoring data and systems using Veritas Backup Exec and Veeam. Epicor Software Corporation is a global leader delivering business software...,Kuala Lumpur,129,,41.4,Senior IT Support Analyst (Desktop & Server Admin)
6,Experian,Malaysia,The Pricing Analyst role provides an excellent opportunity to:. Minimum 5 years experience with proven track record in data analysis....,Cyberjaya,672,,42.6,Pricing Analyst
7,Experian,Malaysia,"Group FP&A Analyst. We are the leading global information services company, providing data and analytical tools to our clients around the world....",Cyberjaya,672,,42.6,Group FP&A Analyst
8,Logicalis,Malaysia,"Minimum 1 year experience in a NOC or Data Centre support environment. Logicalis Australia is part of the Logicalis Group, a global ICT solutions and managed...",Cyberjaya,39,,42.0,Network Analyst
9,Epicor,Malaysia,Technical Support Analyst. Routine preventive maintenance on customer’s servers located at customer’s site or at the data center to prevent or minimize downtime...,Kuala Lumpur,129,,41.4,Technical Support Analyst
0,QuintilesIMS,Malaysia,Monitor trends in supplier’s data submission and investigate any apparent anomalies. Research suspected problems and propose required changes to the data if...,Kuala Lumpur,913,,44.4,Production Analyst
1,Singtel,Malaysia,Handle Proactive Event Management HPOVO for Cloud & Data Centre services. Provide End-to-End request management and fulfillment for Cloud & Data Centre...,Kuala Lumpur,152,,43.8,"Technical Analyst, Cloud & Datacentre"
2,Experian,Malaysia,"Identify test data requirements and test data provisioning. Test Analyst is responsible for preparing the test cases, test scripts, test environment, execution...",Cyberjaya,672,,42.6,Test Analyst
3,Convergys,Malaysia,"Coordinate the implementation of reporting processes (i.e., development of data collection tools and the establishment of data collection and distribution...",Kuala Lumpur,11848,,42.0,Reporting Analyst
4,Johnson Matthey,Malaysia,"Design, develop, test and deploy integration components which will include development of data mapping using XLST, XQuery, Java and configuration of integration...",Kuala Lumpur,141,,41.4,Integration Analyst
5,BP,Malaysia,To support business performance management and planning processes by using consistent data collection and reporting processes;...,Kuala Lumpur,1951,,51.0,Security Analyst
6,Hewlett Packard Enterprise,Malaysia,Applies treasury subject matter expertise in multiple areas of specialization to contribute to treasury programs Communicates with internal teams and managers...,Cyberjaya,2612,,43.8,Treasury Analyst
7,Deloitte,Malaysia,Able to proficiently use various charts and visuals to convey message and data. Ability to conduct exhaustive secondary research i.e. know where to find...,Kuala Lumpur,5329,,51.0,Research Analyst (SEA RA)
8,Fiserv,Malaysia,Accurately performs data conversion and data analysis with assistance from more senior project members initially and once fully trained will be the core...,Kuala Lumpur,1287,,42.0,"Analyst, Financial Performance Services"
0,Expert Integrators - EXI,Malaysia,System Analyst II. Record to Report Analyst. SAP CRM ABAP Analyst (Contract). Knowledge of data warehousing and database concept....,Kuala Lumpur,,,,SAP Associates (Entry Level)
1,Sdrops Solutions,Malaysia,"Create specifications for reports, data and analysis using system reporting tool. Meet individuals to understand business needs and to provide data and analysis...",Kuala Lumpur,,,,Business Analyst
2,Cochlear Ltd,Malaysia,That use item and bill of material data. To support Cochlear's rapid growth we have created a new role for System Analyst for our Global Product Configurator....,Kuala Lumpur,6,,54.0,System Analyst
3,Sdrops Solutions,Malaysia,Passionate in understanding data. Assist in the design of data warehouses to ensure interoperability with reporting solutions....,Kuala Lumpur,,,,Business Intelligence Analyst
4,Citi,Malaysia,"10+ years’ experience in IS and at least 2 IS programs including, but not limited to, Audit Reviews, IS Risk Assessment, Awareness and Training, Identity Access...",Kuala Lumpur,11052,,44.4,Citibank Berhad KL - Information Security Controls Analyst
5,General Mills AMEA,Malaysia,"Comfortable in handling large volume of data. This position reports directly to the FP&A Manager, Korea and SEA....",Kuala Lumpur,1123,,51.0,Financial Planning and Analysis Analyst
6,Deloitte,Malaysia,"Performing primary and secondary research, data analysis and modelling to tackle complex business problems....",Kuala Lumpur,5329,,51.0,MY - GREAT Analyst - Technology - (Oracle)
7,Honeywell,Malaysia,"You will also identify trends and developments in competitive environments and present findings to senior management.Establish clear, consistent reporting and...",Kuala Lumpur,4873,,44.4,Financial Analyst
0,Micro Focus,Malaysia,Provides mentoring and guidance to analysts. Typically 6+ years of experience as a financial analyst. We are looking for a Financial Analyst in Malaysia who...,Kuala Lumpur,100,,44.4,Financial Analyst
1,Honeywell,Malaysia,"Establish clear, consistent reporting and operating processes - ensuring accurate and timely data availability and insightful, thorough analysis....",Kuala Lumpur,4873,,44.4,Financial Planning Analyst
2,Experian,Malaysia,"Service Desk Analyst. This includes ensuring support requests meet data quality requirements, are progressing satisfactorily and stay within agreed SLAs....",Cyberjaya,672,,42.6,Service Desk Analyst
3,BP,Malaysia,"Assist in coordinating the collation and analysis of data in response to the Regional / ad-hoc inquiries, developments and requirements....",Kuala Lumpur,1951,,51.0,Finance Analyst
4,Dimension Data,Malaysia,Diversity in Dimension Data. Join our growing global team and accelerate your career with Dimension Data. Dimension Data is an equal opportunity employer with a...,Petaling Jaya,486,,43.8,PS Business Analyst
6,Ikea,Malaysia,"You have a natural drive for data analysis, have strong analytical skills, and are able to prioritise and structure your own work....",Kota Damansara,3754,,51.0,"E-Commerce Web Analyst, IKEA Southeast Asia"
7,Convergys,Malaysia,"Coordinate the implementation of reporting processes (i.e., development of data collection tools and the establishment of data collection and distribution...",Kuala Lumpur,11848,,42.0,Reporting Analyst - Social
9,Hewlett Packard Enterprise,Malaysia,"Data mining and extraction techniques (e.g. Hewlett Packard Enterprise creates new possibilities for technology to have a meaningful impact on people,...",Cyberjaya,2612,,43.8,Financial Analyst
0,AstraZeneca,Malaysia,Finance Leads and Controllership Analyst in IFS. We have exciting opportunities in this wave of recruitment for Business Analysts in the....,Petaling Jaya,1188,,51.6,IFS Business Analyst
1,LB Aluminum Berhad,Malaysia,Responsible for inspection and to produce result from data after analyst test. To ensure product must be following management specification including quality....,Semenyih,,,,Quality Control Inspector
2,Robert Walters,Malaysia,About the Business Analyst Role:. Great career progression opportunities await the right person in this exciting Business Analyst job....,Klang,33,,43.8,Business Analyst
3,IBM,Malaysia,"Data Analytics - Medium. Enhance basic reporting of data to advanced analytics like segmentation, analytics & optimization as well as data visualization....",Cyberjaya,18061,,51.0,HR Reporting Analyst
4,Bollore Logistics Malaysia Sdn Bhd,Malaysia,"Input data into software systems. Analyse data and prepare relevant reports. Check, match and compile invoices....",Subang Jaya,,,,Internship for Operation Analyst
5,Lazada,Malaysia,"As the pioneer of the eCommerce ecosystem in Southeast Asia, Lazada helps more than 80,000 local and international sellers, as well as 2,500 brands, serve the...",Kuala Lumpur,103,,43.8,Finance Analyst - Treasury
6,Technip,Malaysia,Provide support to analysts during busy periods. Routing tickets to analysts for efficient incident resolution or request management....,Kuala Lumpur,1041,,51.6,Associate Systems Analyst
7,Experian,Malaysia,"We are the leading global information services company, providing data and analytical tools to our clients around the world....",Cyberjaya,672,,42.6,Finance.Analyst - Associate
8,Citi,Malaysia,"AML SVCI Analyst Description. Accurately gather, maintain and utilize data in various product databases for future reference....",Kuala Lumpur,11052,,44.4,Operations Support Analyst
9,Citi,Malaysia,"To ensure the accuracy and timeliness of payroll data, assuring compliance with local policies and regulations. Malaysia,Wilayah Persekutuan,Kuala Lumpur....",Kuala Lumpur,11052,,44.4,Payroll Analyst
0,BHP Billiton,Malaysia,"Master Data Organisation. Analyst, Accounting Processes (Iron Ore) | Kuala Lumpur. Request updates to Finance and other Master Data as required....",Kuala Lumpur,550,,51.6,"Analyst, Accounting Processes"
1,Cargill,Malaysia,Business Analyst (Plant Ops- Product- SAP PP). Familiarity with Business Analyst Body of Knowledge (BABOK). The Business Analyst will work closely with business...,Kuala Lumpur,1820,,43.8,Business Analyst (Plant Ops- Product- SAP PP)
2,BHP Billiton,Malaysia,Payroll and Data Administrator/ Analyst. Analyst HR People System. Identify and implement improvement initiatives and ensure coherence of process between team...,Kuala Lumpur,550,,51.6,Lead HR People System
3,Data Matriqs Sdn Bhd,Malaysia,"Troubleshoot existing data model & dashboards. Extract,transform & load data from multiple sources into QlikView....",Kuala Lumpur,,,,QlikSense Analyst
4,Six Degree Consulting,Malaysia,"Identify when reconciliation repository tool needs master data maintained, utilize reconciliation repository tool to document account reconciliations and route...",Puchong,,,,Finance Analyst - GA
5,AIG,Malaysia,Serve as the senior subject mater expert for the data privacy regulatory requirements in APAC Region. Korea and Taiwan have Data Privacy issues and sanctions...,Kuala Lumpur,2126,,43.8,Business Analyst – Sanctions APAC
6,See Hoy Chan Sdn Berhad,Malaysia,Understand and maintain master data governance for supported functional area. Input document data into the standard registers ensuring that the information is...,Kota Damansara,,,,Business Analyst
7,McKinsey & Company,Malaysia,"Your responsibilities will be to provide centralized support to client service teams, and assist in problem solving and data interpretation....",Kuala Lumpur,293,,52.8,Project Accountant - Financial Analyst
9,,Malaysia,"Manufacturing system experience required for Radius Analyst role. Perform data analysis and application development, including minor programming, to support...",Kuala Lumpur,,,,Business Systems Analyst (ERP / SAP)
0,Marsh,Malaysia,"Will assist in managing budget, business planning, opportunity prospecting, client-service and data analysis....",Kuala Lumpur,139,,43.2,Executive Assistant
1,McKinsey & Company,Malaysia,"As one of the fastest-growing parts of our firm, New Ventures has more than 1,500 dedicated professionals (including more than 800 analysts and data scientists)...",Kuala Lumpur,293,,52.8,Analyst - Diligence And Business Intelligence
2,"Amdocs, Inc.",Malaysia,You will be able to use your superior business analyst skills to make a significant impact on high-level solutions that best produces the optimal product...,Kuala Lumpur,697,,44.4,Business Analyst
3,amdocs,Malaysia,You will be able to use your superior business analyst skills to make a significant impact on high-level solutions that best produces the optimal product...,Kuala Lumpur,697,,44.4,Business Analyst
4,AIG,Malaysia,"Support opportunities to improve and streamline processes regarding data flow and data quality to improve data accuracy, completeness and value....",Kuala Lumpur,2126,,43.8,Business Intelligence Analyst
5,Standard Chartered Bank,Malaysia,"Able to analyze data trends and out of pattern activities, working knowledge of Internet and MS Office Suite & independently assimilate, analyse and evaluate...",Klang,1797,,51.6,Senior Analyst Communication Surveillance
6,AIG,Malaysia,Enter all relevant details into the Event record and ensure that this data is accurate. Has sufficient knowledge of IT Infrastructure to understand and analyze...,Cyberjaya,2126,,43.8,IT Support Svcs Analyst III
7,Visual Solutions (M) Sdn Bhd,Malaysia,"Coordinates preparation internal and external reports through gathering, analysing and summarizing data and information from the departments....",Petaling Jaya,,,,Internship as Project Analyst
8,DELL,Malaysia,"Support LAN data network and have good knowledge in STP, LAN Switching, HSRP. Why Work at Dell?...",Cyberjaya,5898,,51.0,"Analyst, IT Service Ops"
9,Deloitte,Malaysia,"Experience with data analysis applications such as ACL, SQL, or Access preferred. Playing role in designated tasks of the project team in gathering, organizing...",Kuala Lumpur,5329,,51.0,"Consultant / Analyst, Contract Risk & Compliance"
0,Amway Inc.,Malaysia,Data validation and Business Test execution with Subject Matter Experts for the area “Distributor Experience”....,Kota Damansara,,,,Business Analyst II - Distributor Experience
1,Citi,Malaysia,Perform Ad hoc data analysis. Provide feedback and coaching to analysts. The candidate is required to design internal fraud detection rules and perform ad hoc...,Kuala Lumpur,11052,,44.4,MYS CTSM KL - Business Data Analyst
2,Petro1 Sdn Bhd,Malaysia,Consulting research industry holding research analyst position who think they can generate more money from their research rather than statistic and data....,Petaling Jaya,,,,Telesales Executive
3,AS White Global,Malaysia,"Diploma, Bachelor Degree/Professional Degree or Master Degree equivalent is advantageous Data Entry Agent/ Data Analyst in Malaysia X....",Kuala Lumpur,,,,"Claim Processor Analyst/Data Analyst in Malaysia (Intake October 30, 2017)"
4,ResMed,Malaysia,Assist Business analyst to resolve workflow related issue. Makes effective decisions based on relevant data and area of expertise....,Kuala Lumpur,61,,43.8,IT Application System Administrator
5,Experian,Malaysia,"We are the leading global information services company, providing data and analytical tools to our clients around the world. Business Analyst/SQL Developer....",Cyberjaya,672,,42.6,Business Analyst/SQL Developer
6,Experian,Malaysia,Supervise two data quality analysts based in Cyberjaya. Cross-functional data and reporting alignment. Acquisition integration and data migration projects....,Cyberjaya,672,,42.6,APAC CoE Data Quality Team Lead
7,DELL,Malaysia,"Knowledge performing Data Integrations using ​WebServices and API methods; Performance analyst, capacity planner information system modeler, design engineer,...",Cyberjaya,5898,,51.0,"Advisor, IT Infrastructure"
8,CO3 SOCIAL OFFICE,Malaysia,"Collect and maintain portfolio-wide data, particularly for Portfolio. Provide market-specific and portfolio-wide analytics and insights across Malaysia....",Puchong,,,,REAL ESTATE ANALYST
9,Citi,Malaysia,"Primary Location: Malaysia,Wilayah Persekutuan,Kuala Lumpur Education: Bachelor's Degree Job Function: Operations Schedule: Full-time Shift: Day Job Employee...",Kuala Lumpur,11052,,44.4,MYS CTSM KL - AML M&I Data Intelligence Investigation Risk Analyst Lead
0,Career Channel,Malaysia,Data gathered on the credibility of the customers globally and recommend. Perform credit evaluation for customers within a....,Subang Jaya,,,,Finance Analyst - Credit Review
1,AXA : France,Malaysia,Support the lead analyst to perform analysis on the pros and cons of each solution option to ensure that lead analyst has adequate information to educate the...,Kuala Lumpur,,,,Business Analyst
3,Kimberly-Clark,Malaysia,"Minimum 3-4 years of relevant working experience and preferably in the same capacity, including practical experience in tax data compilation....",Kuala Lumpur,882,,51.0,Tax & Financial Analyst
4,BASF Asia Pacific,Malaysia,Ensure all processed data are reviewed accordingly and perform 100% master data checking to ensure accurate data are reported....,Kuala Lumpur,2,,54.0,"12 months contract - Analyst, Master Data (HR Service)"
5,Networkers,Malaysia,"As a member of a team of analysts, data engineers and data scientists, this role will lead and. Senior Data Scientist (Advisory)....",Kuala Lumpur,10,,51.0,Senior Data Scientist (Trainer)
6,Orange,Malaysia,"Network Optimization Review (NOR) support – prepare data for regular internal meetings especialy on unit costs, trends and various financial KPIs.Digitalization...",Kuala Lumpur,1158,,51.6,Voice and Video Network Rate and Billing Analyst
7,BAE Systems Applied Intelligence,Malaysia,Test data creation and maintenance. Create frameworks for creation and maintenance of test data. Proven experience of testing complex user interfaces and/or of...,Kuala Lumpur,34,,43.2,Automation Developer/ Senior Automation Developer
8,Tan Chong,Malaysia,Experience in data mining. We are looking for a Data Analyst to analyze raw information and translate as business insight as per requirement....,Seri Kembangan,,,,Senior Data Analyst
9,Tan Chong Group,Malaysia,Experience in data mining. We are looking for a Data Analyst to analyze raw information and translate as business insight as per requirement....,Seri Kembangan,,,,Senior Data Analyst
0,Hitachi Solutions,Malaysia,"Plan and perform data migration using DIXF into Microsoft Dynamics AX. To be able to provide full cycle implementation, consulting, configuration, training,...",Kuala Lumpur,1093,,44.4,Dynamics AX Business Analyst- Finance
1,Black Arm Bhd,Malaysia,Perform analysis of marketing and sales data. Help with collection and synthesis of quantitative and qualitative data from client marketing campaigns....,Kuala Lumpur,,,,Internship for Market Analyst Assistant
2,Accenture,Malaysia,"Examples of Accenture’s ServiceNow implementations in non-IT contexts include using ServiceNow as a Learning Management System, integrating with Plant systems...",Kuala Lumpur,11379,,51.0,ServiceNow Analyst/Specialist
3,BP,Malaysia,"Quality Assurance, Data & Reporting:. Providing day-to-day advice and guidance in support of the HR Analysts and Senior Analysts and wider teams deliverables....",Kuala Lumpur,1951,,51.0,HR Services Administration- Team Lead
4,Aimia,Malaysia,Cope with data analysts and consultants to provide KPI reports and provide insights and effective recommendations for future improvement....,Kuala Lumpur,74,,42.6,Account Executive
5,Citi,Malaysia,"Specific experience in Securities related functions e.g. Corporate Actions/Asset Servicing, Settlement, SWIFT message and Data Maintenance, Account opening,...",Kuala Lumpur,11052,,44.4,MYS CTSM KL - Intermediate Customer Service Analyst
6,Citi,Malaysia,"And Data Maintenance, Account opening, Custody Tax Services, Cash processing, Settlement or Customer Service will. Malaysia,Wilayah Persekutuan,Kuala Lumpur....",Kuala Lumpur,11052,,44.4,MYS CTSM KL - Customer Service Analyst
7,Citi,Malaysia,Performing peer review of investigations to ensure appropriate dispositions have been recommended by analyst. Demonstrated ability to perform detailed analysis...,Kuala Lumpur,11052,,44.4,MYS CTSM KL - AML Sanctions Screening Operations Senior Analyst
8,BP,Malaysia,"People data and core HR processes; Employee Data Administration processing such as updating employee data in SAP system, updating existing employee T&C,...",Kuala Lumpur,1951,,51.0,"Senior Analyst – Workforce, Recruitment & On-Boarding"
9,Shell,Malaysia,"Process & Data Management Knowledge. Accounting & reporting issues, data issues) in a dynamic environment. Together with the Finance Advisors, the incumbent...",Cyberjaya,2968,,44.4,Upstream Financial Planning & Analysis (Business Analyst)
0,Shell,Malaysia,"Complete all indirect tax related accounting activities upon which indirect tax returns depends, including control checks of transactional data to identify any...",Kuala Lumpur,2968,,44.4,Analyst - Manage Indirect Tax
1,Shell,Malaysia,Process and Data Management.  Process and Data Management.  Identify missing data and understand the process for ensuring that data is included in the...,Kuala Lumpur,2968,,44.4,Analyst - Manage HC Inventory
2,Standard Chartered Bank,Malaysia,"Director, Compliance, Financial Markets, Trade Surveillance, Data Quality & Projects. Regular/Temporary:....",Klang,1797,,51.6,"Trade Surveillance, Analyst"
3,Basis Corporation Sdn Bhd,Malaysia,Collection of data & capturing the data into database. Data verification & compilation of reports. Carry out various research studies & surveys....,Kuala Lumpur,,,,Internship for Financial Analysts
4,Citi,Malaysia,"Manage Data change requests end-to-end and track, escalate and resolve any data anomalies. Basic understanding of data administration within a database...",Kuala Lumpur,11052,,44.4,MYS CTSM KL - User Acceptance Testing - Senior Tester
5,Networkers,Malaysia,"Analysis of real-time data feeds and triage for potential intrusions and attacks in a 24/7 environment. Leverage of data analysis techniques, human intuition,...",Cyberjaya,10,,51.0,IT Security Analyst
6,GfK,Malaysia,"Assist in questionnaire design and data tabulation. You will enjoy working in a dynamic, international working environment where you will assist our analysts to...",Kuala Lumpur,102,,44.4,Intern for Market Research
7,iflix,Malaysia,"Business Analyst experience; Lead technical projects in Asia- Implement process and quality improvements, initiate data analysis for designated regions, make...",Kuala Lumpur,,,,Technical Project Manager
8,Robert Walters,Malaysia,"Componentisation, implementation of micro-services layer, integration with data analytics is preferred. At least 15 years' team management experience, typically...",Kuala Lumpur,33,,43.8,"Head, Core Banking"
9,Robert Walters,Malaysia,About the Business Planning Analyst Role:. Great career progression opportunities await the right person in this exciting Business Planning Analyst job....,Kuala Lumpur,33,,43.8,Business Planning Analyst
0,iflix,Malaysia,WE’RE SEARCHING FOR AWESOME ANALYST S TO:. We are searching for an Analyst to join our team of superheroes in Kuala Lumpur!...,Kuala Lumpur,,,,Global Content Planning and Analysis
1,Berkshire Media Sdn Bhd,Malaysia,Interpret data and analyse results using statistical techniques and assist data analysts with ongoing reports. Filter and clean data....,Petaling Jaya,,,,Internship for Business
2,Shell,Malaysia,Investigate payment discrepancy reason if the customer fails to provide it in their remittance data. Responsible for performing debt collection activities for...,Cyberjaya,2968,,44.4,Analyst - Credit Debt Collection
3,McKinsey & Company,Malaysia,"As one of the fastest-growing parts of our firm, New Ventures has more than 1,000 dedicated professionals (including more than 800 analysts and data scientists)...",Kuala Lumpur,293,,52.8,"Associate - Performance Improvement, Energy Insights"
