,company,country,description,location,review,salary,star,title
7,Hong Leong Islamic Bank - MY,Malaysia,Prior experience in managing a small or medium sized team of analysts is preferred. HLB is embarking on a comprehensive multi-year regional BIG DATA and...,Kuala Lumpur,,,,"Manager, Credit Card & Unsecured Loan Analytics"
8,Citi,Malaysia,"Specific experience in Securities related functions e.g. Client Services, Corporate Actions, Settlement, Data Maintenance and Billing or Custody Account Opening...",Kuala Lumpur,11052,,44.4,MYS CTSM KL - Asset Servicing Analyst
0,Expert Integrators - EXI,Malaysia,System Analyst II. Record to Report Analyst. SAP CRM ABAP Analyst (Contract). Knowledge of data warehousing and database concept....,Kuala Lumpur,,,,System Analyst II
1,Hong Leong Islamic Bank - MY,Malaysia,"Oracle Data Integrator (ODI), Informatica); The BI Analyst is responsible for managing all projects from a technical perspective and should be able to...",Kuala Lumpur,,,,"Manager, Business Intelligence, IT Application (Analyst)"
2,EPS Malaysia,Malaysia,Client Background: US-Based MNC Industry: Shared Services Centre Location: Petaling Jaya Headcount: 1 Tenure: Permanent Responsibilities: · Responsible...,Petaling Jaya,,,,Senior Customer Service Analyst
3,Kantar Worldpanel,Malaysia,"Kantar is the data investment management division of WPP. Join us and you’ll be part of 30,000 colleagues and 12 world leading research, data and insight brands...",Kuala Lumpur,39,,51.0,Account Manager
4,KPMG,Malaysia,Apply data analytic techniques to audit processes across key business cycles; At least 3 years of working experience as an IT auditor / IT analyst / IT...,Petaling Jaya,3631,,51.0,Assistant Manager – Information Risk Management (IRM) Specialist
5,WorleyParsons,Malaysia,Review Budget/Forecast data and make comparison with Actuals. Advanced skills in Excel and understanding of any ERP data storage is crucial....,Kuala Lumpur,1167,,44.4,"Finance Manager, Global Support Function"
6,HSBC,Malaysia,Ability to coach & manage analysts across levels. To deputise for the Business Analysts as and when required....,Kuala Lumpur,8322,,51.0,Business Analytics Manager I
7,BASF Asia Pacific,Malaysia,"Ensure accuracy of VAT data and liaisewith LC coordinator on VAT-related. Effectivelymanage, supervise and support the analysts to deliver services to BASF...",Kuala Lumpur,2,,54.0,"Manager, Accounts Payable"
8,Career Channel,Malaysia,"Marketing, research and data analyst within the industry to extract relevant. Data for marketing decision making....",Kuala Lumpur,,,,Head of Business Intelligence and Data Analytics
9,FrogAsia,Malaysia,The Business Intelligence Analyst will be part of this transformation to drive how we explore and utilize data in the FrogAsia’s daily and strategic operations....,Sentul,,,,Business Intelligence Analyst
0,BASF Asia Pacific,Malaysia,"To support and back up other analyst in performingManagement Accounting tasks as required. To maintainand ensure master data regarding material ledger,...",Kuala Lumpur,2,,54.0,"Analyst, Management Accounting (Non Trade Business)"
1,Hong Leong Islamic Bank - MY,Malaysia,Previous data management experience. To assist in ensuring all data required for future modeling work is captured with good data quality....,Kuala Lumpur,,,,"Manager, Scoring Platform"
2,Robert Walters,Malaysia,"This is a rapidly expanding market research organisation that focuses on consumer life-cycle data, social media analysis and big data....",Petaling Jaya,33,,43.8,Business Development Manager
3,Citi,Malaysia,"Specific experience in Securities related functions eg Client Services, Corporate Actions, Settlement, Data Maintenance & Billing or Custody Account Opening...",Kuala Lumpur,11052,,44.4,MYS CTSM KL - Associate Asset Servicing Analyst
4,Techsap ASP,Malaysia,"Understands, manipulates and analyzes electronic data (primarily in Excel or Access). Work directly with finance tags within various business units we support...",Kota Damansara,,,,Accounts Payable (AP) Support Analyst
5,Shell,Malaysia,Undertake desktop research using a combination of publically available and commercially licensed IT tools and data sources....,Kuala Lumpur,2968,,44.4,Due Diligence Screening Analyst (Vietnamese Speaker)
6,Citi,Malaysia,"Single point of contact in Risk & Control team on all cross border Data clearances within the region by working closely with Regional & Global stakeholders,...",Kuala Lumpur,11052,,44.4,"MYS CTSM KL - Risk & Control Manager, AML APAC M&I"
7,Expert Integrators - EXI,Malaysia,System Analyst II. Record to Report Analyst. SAP CRM ABAP Analyst (Contract). Knowledge of data warehousing and database concept....,Kuala Lumpur,,,,Service Delivery Managers (3 positions)
8,Expert Integrators - EXI,Malaysia,System Analyst II. Record to Report Analyst. SAP CRM ABAP Analyst (Contract). Knowledge of data warehousing and database concept....,Kuala Lumpur,,,,SAP Basis (HANA) Consultant
0,Expert Integrators - EXI,Malaysia,System Analyst II. Record to Report Analyst. SAP CRM ABAP Analyst (Contract). Knowledge of data warehousing and database concept....,Kuala Lumpur,,,,IT Helpdesk (Wintel/Citrix)
1,Graduan.com.my,Malaysia,"Advocating for additional data and/or services are necessary to address key business issues. IT Business Analyst develops requirements, for process or system...",Kuala Lumpur,,,,IT Business Analyst
2,Shell,Malaysia,Perform analyst role in balance sheet reconciliations (Status of Accounts Reporting) ensuring all control requirements met on a timely basis....,Cyberjaya,2968,,44.4,Upstream Finance Accountant
3,Graduan.com.my,Malaysia,Support GPBSOH and PvB Business on preparation of data / information for Regulatory Enquiries Responses....,Kuala Lumpur,,,,"Senior Investigations Analyst, Private Banking Operations"
4,Oracle,Malaysia,"Engage with prospect organizations to position the Oracle solution through value based selling, business case definition, ROI analysis, references and analyst...",Kuala Lumpur,3080,,44.4,IAAS Sales Specialist - MY
5,Robert Walters,Malaysia,About the BP&A Senior Analyst Role:. Great career progression opportunities await the right person in this exciting BP&A Senior Analyst job....,Kuala Lumpur,33,,43.8,BP&A Senior Analyst
6,Telarix,Malaysia,"Assist client with proper collection, validation, and population of client data. We are looking for Business Analysts who would assist our clients in applying...",Kuala Lumpur,3,,43.2,Network Integration Engineer
8,BASF Asia Pacific,Malaysia,"Act as mentor to Senior analysts and Analysts to encourage goodpractice, team spirit and a quality-orientated approach Compliance:....",Kuala Lumpur,2,,54.0,"Manager, Management Accounting"
9,Expert Integrators - EXI,Malaysia,System Analyst II. Record to Report Analyst. SAP CRM ABAP Analyst (Contract). Knowledge of data warehousing and database concept....,Kuala Lumpur,,,,IT Manager (Infrastructure)
0,Career Channel,Malaysia,"Generates and compiles data based on interactions with the business teams. Works with customers, gathers and analyzes appreciate data to develop business cases,...",Cyberjaya,,,,IT BUSINESS ANALYST
1,Expert Integrators - EXI,Malaysia,System Analyst II. Record to Report Analyst. SAP CRM ABAP Analyst (Contract). Knowledge of data warehousing and database concept....,Kuala Lumpur,,,,Java Developer
2,Expert Integrators - EXI,Malaysia,System Analyst II. Record to Report Analyst. SAP CRM ABAP Analyst (Contract). Knowledge of data warehousing and database concept....,Kuala Lumpur,,,,SAP Team Lead (FICO)
3,Robert Walters,Malaysia,"About the Senior System Analyst Role:. In this business critical role, you will be responsible for extending the data warehouse model based on business...",Kuala Lumpur,33,,43.8,Senior System Analyst
4,Expert Integrators - EXI,Malaysia,System Analyst II. Record to Report Analyst. SAP CRM ABAP Analyst (Contract). Knowledge of data warehousing and database concept....,Kuala Lumpur,,,,ABAP Consultant
5,Washington Frank,Malaysia,Generates and compiles data based on interactions with the business teams. An exciting Oracle EBS System Analyst position has just become available in a MNC...,Cyberjaya,,,,Oracle EBS Senior System Analyst
6,Expert Integrators - EXI,Malaysia,System Analyst II. Record to Report Analyst. SAP CRM ABAP Analyst (Contract). Knowledge of data warehousing and database concept....,Kuala Lumpur,,,,SAP CRM ABAP Analyst (Contract)
7,Expert Integrators - EXI,Malaysia,System Analyst II. Record to Report Analyst. SAP CRM ABAP Analyst (Contract). Knowledge of data warehousing and database concept....,Kuala Lumpur,,,,SAP MM Consultant (Cyberjaya)
8,Expert Integrators - EXI,Malaysia,System Analyst II. Record to Report Analyst. SAP CRM ABAP Analyst (Contract). Knowledge of data warehousing and database concept....,Kuala Lumpur,,,,SAP OTC (SD) Consultant
9,Expert Integrators - EXI,Malaysia,System Analyst II. Record to Report Analyst. SAP CRM ABAP Analyst (Contract). Knowledge of data warehousing and database concept....,Kuala Lumpur,,,,SAP BI/HANA consultant (Singapore)
0,Expert Integrators - EXI,Malaysia,System Analyst II. Record to Report Analyst. SAP CRM ABAP Analyst (Contract). Knowledge of data warehousing and database concept....,Kuala Lumpur,,,,SAP BI/BOBJ (HANA) Consultant - Singapore
1,Robert Walters,Malaysia,"Manage a team of Financial Analysts to support assigned countries. Strong interpersonal skills and ability to communicate well with all levels of management,...",Kuala Lumpur,33,,43.8,Financial Planning and Analysis Manager
2,Genesys,Malaysia,Provides tier 1 & tier 2 support escalation for all data center infrastructure and related services. The NOC Analyst is responsible for monitoring all equipment...,Kuala Lumpur,70,,42.6,IS22T1 - Associate Network Systems Engineer
3,Expert Integrators - EXI,Malaysia,System Analyst II. Record to Report Analyst. SAP CRM ABAP Analyst (Contract). Knowledge of data warehousing and database concept....,Kuala Lumpur,,,,IT Project Manager (Cloud based)
4,Expert Integrators - EXI,Malaysia,System Analyst II. Record to Report Analyst. SAP CRM ABAP Analyst (Contract). Knowledge of data warehousing and database concept....,Kuala Lumpur,,,,SAP Manager (Support)
5,Expert Integrators - EXI,Malaysia,System Analyst II. Record to Report Analyst. SAP CRM ABAP Analyst (Contract). Knowledge of data warehousing and database concept....,Kuala Lumpur,,,,SAP Service Delivery Manager (Singapore)
6,Expert Integrators - EXI,Malaysia,System Analyst II. Record to Report Analyst. SAP CRM ABAP Analyst (Contract). Knowledge of data warehousing and database concept....,Kuala Lumpur,,,,SAP FICO Consultant / Senior Consultant (2 positions @KL - permanent)
7,Expert Integrators - EXI,Malaysia,System Analyst II. Record to Report Analyst. SAP CRM ABAP Analyst (Contract). Knowledge of data warehousing and database concept....,Kuala Lumpur,,,,DOT NET (.NET) Developers
9,Michael Page,Malaysia,Ensure all processed data and reviewed accordingly and perform 100% master data checking to ensure accurate data are reported....,Kuala Lumpur,157,,42.0,"SAP System Analyst (Level 1, Mandarin Speaking) - Global insurance company"
0,Expert Integrators - EXI,Malaysia,System Analyst II. Record to Report Analyst. SAP CRM ABAP Analyst (Contract). Knowledge of data warehousing and database concept....,Kuala Lumpur,,,,Senior Recruiter
1,EY,Malaysia,"We go beyond strategy and provide end to end implementation of real life data environments and have some of the best architects, project managers, business...",Kuala Lumpur,3885,,51.0,"Senior Associate, Advisory Performance Improvement, EY Data and Analytics (Malaysia)"
2,Michael Page,Malaysia,Data architecture Oracle ERP applications and development tools experience is an added advantage....,Kuala Lumpur,157,,42.0,"Senior Oracle Financial Analyst (AP, AR, GL)"
3,Hewlett Packard Enterprise,Malaysia,"Gathers financial data and performs financial analyses and reporting (e.g., profit & loss, balance sheet, cash flow, pricing, etc.)....",Cyberjaya,2612,,43.8,Finance Manager
4,Deloitte,Malaysia,"Understanding of current IT trends (cloud computing, big data, socialmedia, RPA, IoT, blockchain, etc.)....",Kuala Lumpur,5329,,51.0,MY - Consultant - Technology – Technology Strategy & Architecture (with ITIL and ITSM framework strategy experience)
5,Citi,Malaysia,"Directly manage team of Data Analysts / Mantas Consultants related to various Data Intelligence functions – Global Emerging Risk Analytics, Global Investigation...",Kuala Lumpur,11052,,44.4,MY CTSM KL - AML APAC M&I Transformation – Monitoring Solutions and Analytics (MSA) Lead
6,Citi,Malaysia,"Validate data, identify data quality issues (if any) and address them. Apply qualitative and quantitative data analysis methods....",Kuala Lumpur,11052,,44.4,MYS CTSM KL - AML Scenario Management and Validation (SMV) Business Analyst/Report Writer
7,Expert Integrators - EXI,Malaysia,System Analyst II. Record to Report Analyst. SAP CRM ABAP Analyst (Contract). Knowledge of data warehousing and database concept....,Kuala Lumpur,,,,Finance Manager (Subang Jaya / Shah Alam)
0,Citi,Malaysia,"Primary Location: Malaysia,Wilayah Persekutuan,Kuala Lumpur Education: Bachelor's Degree Job Function: Operations Schedule: Full-time Shift: Day Job Employee...",Kuala Lumpur,11052,,44.4,MYS CTSM KL - AML Monitoring & Investigation Data Intelligence Regional Lead
1,Pasona Malaysia,Malaysia,Orders and vendor master data. Prepare monthly procurement related reports....,Petaling Jaya,8,,43.8,Purchasing Analyst 2 (Mandarin Speaker)
2,Career Medi,Malaysia,"Troubleshoot issues with shopping carts, purchase orders and vendor master data. Understand and maintain expert level knowledge of business and processes...",Petaling Jaya,,,,Purchasing Analyst I (Mandarin / Thai Speaker)
3,Deloitte,Malaysia,"IBM DataStage, Informatica, SAP Business ObjectsData Services, Oracle Data Integrator. As a leader in data management (BI, Big Data or Analytics),you'll be able...",Kuala Lumpur,5329,,51.0,"MY – Senior Manager / Manager - Technology – Analytic & Information Management (BI, Big Data or Analytics)"
4,Career Medi,Malaysia,"Troubleshoot issues with invoices processing, shopping carts, purchase orders and vendor master data. NJS/VL.LL.7.2....",Petaling Jaya,,,,Purchasing Analyst II (Mandarin Speaker)
5,Credit Guarantee Corporation - CGC Malaysia,Malaysia,At least 2 year (s) for Risk Analyst and 4 year(s) for Senior Risk Analyst of working experience in the related field is required for this positions....,Petaling Jaya,,,,"Senior Risk Analyst / Risk Analyst (Operational Risk), Risk Management Department"
6,Michael Page,Malaysia,"Create and change Master Data. Transfer Pricing - perform maintenance of master data. Perform overhead management eg Planning, Master data maintenance...",Kuala Lumpur,157,,42.0,"Senior Analyst, Costing (Management Accounting)"
7,Rentokil Malaysia,Malaysia,"We are looking for a motivated, dynamic Sales Analyst Executive to join our team based in head office. Provide supports to Sales Director and Area Sales Manager...",Petaling Jaya,,,,Sales Analyst Executive
8,Deloitte,Malaysia,"Understanding of current IT trends (cloud computing, big data, socialmedia, RPA, IoT, blockchain, etc.)....",Kuala Lumpur,5329,,51.0,MY - Consultant - Technology – Technology Strategy & Architecture (with IT sourcing experience)
9,Cargill,Malaysia,"Champion data as a corporate asset, ensuring the value realization of the investments Cargill is making in the data and information areas are captured....",Kuala Lumpur,1820,,43.8,Solution Architect – Trading APAC
0,INNITY,Malaysia,"Numerically inclined and like to work with data and facts. An Advanced/Higher/Graduate Diploma, or Bachelor’s Degree, Post Graduate Diploma or Professional...",Petaling Jaya,,,,Sales Analyst
1,Citi,Malaysia,"Review work includes Data analysis, report reviews, review of documents / Voice logs, and conducting call outs to customers....",Kuala Lumpur,11052,,44.4,CTSM KL - Investment and Insurance Sales Surveillance Analyst
2,Expert Integrators - EXI,Malaysia,System Analyst II. Record to Report Analyst. SAP CRM ABAP Analyst (Contract). Knowledge of data warehousing and database concept....,Kuala Lumpur,,,,SAP CRM Consultant (Hybris C4C)
3,Kimberly-Clark,Malaysia,Strong collaboration skills to work with other Business Analysts and across functions. Aptitude with business information systems (SAP and Microsoft Excel) and...,Kuala Lumpur,882,,51.0,"Sales Business Analyst, Malaysia & Singapore"
4,iPROPERTY GROUP,Malaysia,Personal data provided by job applicants will be used strictly in accordance with the employer’s personal data policies....,Kuala Lumpur,,,,Sales and Marketing Analyst
5,Deloitte,Malaysia,"Understanding of current IT trends (cloud computing, big data, socialmedia, RPA, IoT, blockchain, etc.)....",Kuala Lumpur,5329,,51.0,MY - Senior Consultant - Technology – Technology Strategy & Architecture (with ITIL and ITSM framework strategy experience)
6,Rough Sea Marine,Malaysia,"Ã¯ÂÂ¬Conduct statistical and data analytic. Ã¯ÂÂ¬Supervise a staff ofÃ market research analysts. Ã¯ÂÂ¬Analyse all sales data for profitability, product mix,...",Bandar Sunway,,,,Sales And Marketing Manager
7,Citi,Malaysia,"Collect and aggregate AML metrics for measurable AML data which includes alert cases generated, cases ageing, investigations generated, investigations ageing,...",Kuala Lumpur,11052,,44.4,MYS CTSM KL - Intermediate Compliance Analyst - AML Core - Assistant Manager/Manager
8,EY,Malaysia,"Information Management, Business Intelligence, Data Warehousing and Big Data project experience. We go beyond strategy and provide end to end implementation of...",Kuala Lumpur,3885,,51.0,"Big Data Architect Manager / Senior Manager, EY Data and Analytics (Malaysia)"
9,Khai Business Consultancy,Malaysia,"Hi,I'm looking for Data Analyst. Remuneration paid in USD Permanent position Location: Ampang Park , Glovent Business Centre Sdn Bhd, B-8-8, Megan Avenue 1...",Ampang,,"RM 3,000 a month",,data analysis
0,Data Synergo Sdn Bhd,Malaysia,Ensuring high quality data is collected and integrity of the data. Developing of programs and data that can be used for data analysis and presentation....,Petaling Jaya,,"RM 2,000 - RM 3,000 a month",,Data Analyst
1,EPS Ventures,Malaysia,"Job Scope: * Manage Sensitive Contents on social media * Responsible for reviewing photos, videos, and text-based content and make judgements as to whether...",Kuala Lumpur,,"RM 3,000 a month",,Data Review Analyst
3,EPS Malaysia,Malaysia,"Loads product data into electronic specification and/ or visual tools, per Company’s corporate change request system, to ensure current product data is...",Kuala Lumpur,,,,Programmer Analyst
4,Michael Page,Malaysia,Coordinate data cleansing activities and perform data upload into SAP system as part of data conversion activities....,Kuala Lumpur,157,,42.0,SAP FICO Support Analyst (Mandarin Speaker)
5,Robert Walters,Malaysia,About the Sales & Marketing Analyst Role :. Work with data engineers to create pre-fabricated data stores to be enabled on key business metrics related to sales...,Kuala Lumpur,33,,43.8,Sales & Marketing Analyst
6,Michael Page,Malaysia,Minimum of 1-2 years of experience of SAP business processes within Master Data modules. Attractive remuneration and benefits....,Kuala Lumpur,157,,42.0,SAP Support Analyst (Mandarin Speaker) - Global FMCG brand
7,Michael Page,Malaysia,"Perform analysis with commentaries on the relevant financial reporting statements, to provide business partners with accurate data for decision making....",Kuala Lumpur,157,,42.0,Financial Analyst - Mandarin speaker preferred
8,Michael Page,Malaysia,"Identify, recommend and implement solutions in consultation with Managers and Senior Analysts for continuous improvement opportunities in the areas of operation...",Kuala Lumpur,157,,42.0,"Analyst, General Accounting & Reporting - Mandarin speaker preferred"
9,Michael Page,Malaysia,"Summarizing data, information, and trends. Prepares monthly statements by collecting data; Involved in quarterly and annual reports by assembling data....",Kuala Lumpur,157,,42.0,General Accounting Analyst (RTR) - Mandarin speaker preferred
0,Timesconsult,Malaysia,To perform data entry function. Perform data input of insurance applications by keying into system and verifying the accuracy of data entry....,Cyberjaya,,"RM 2,000 - RM 3,000 a month",,"Data Analyst Associate (6 OR 12 months contract) @ MNC, Cyberjaya"
1,Michael Page,Malaysia,A great analyst role with an established MNC. Responsible to ensure accuracy of materials master data setup in SAP system....,Kuala Lumpur,157,,42.0,Senior Supply Planner - S&OP experience required
2,JobHelp,Malaysia,Data entry experience required.Desired Competencies (Typical):. 8.30am – 5.30pm (Mon-Fri)....,Subang Jaya,,"RM 2,450 a month",,"Analyst, DPAC"
3,Agensi Pekerjaan Ideal Reliance Sdn Bhd,Malaysia,"Employed in different areas - payroll, time, personnel administration, organization management, data, authorisation, reporting, self service, workflow,...",Petaling Jaya,,"RM 3,000 a month",,HR Process Analyst
4,Signature Trend Sdn. Bhd.,Malaysia,"Signature Trend Sdn Bhd (""ST Advisory"") is a boutique management and data consulting firm, specialized in Strategy, Corporate Finance, Transformation Management...",Bangsar,,"RM 2,700 - RM 3,200 a month",,Marketing & Data Analyst
5,ManpowerGroup Malaysia,Malaysia,Ensure data management for all deliverable and be accessible. Articulate data and analysis to stake holders and client....,Cyberjaya,,"RM 3,500 - RM 4,000 a month",,Quality Analyst
6,Crest Force Recruitment Agency,Malaysia,Business Analyst (Contract 1 Year)*. Collaborate with business units and MIS team in implementing required changes to data model....,Bandar Sunway,,"RM 4,000 - RM 5,000 a month",,BUSINESS ANALYST (1 YEAR CONTRACT)
7,TalentC Recruit,Malaysia,"Working knowledge of UML, Use Case definition, Data Analysis or Data Modeling. Facilitate the business analyst in confirming the to-be process flow....",Petaling Jaya,,"RM 8,000 a month",,System Analyst
8,Agensi Pekerjaan TalentC Recruit Sdn Bhd,Malaysia,"Working knowledge of UML, Use Case definition, Data Analysis or Data Modeling. Facilitate the business analyst in confirming the to-be process flow....",Petaling Jaya,,"RM 8,000 a month",,System Analyst (J2EE experience) @ PJ
0,Trueventus Sdn.Bhd,Malaysia,"Research outputs encompassing data collection, interpretation, analysis, reports or papers, presentations and recommendations....",Kuala Lumpur,,"RM 2,200 - RM 3,000 a month",,Research Associate
1,CY INTERTRADE SDN. BHD.,Malaysia,Provide support to the Operations Analyst and Corporate Pricing team as needed to ensure the timely and accurate data for monthly reports....,Klang,,,,ACCOUNTANT
2,Masslogic LLP,Malaysia,"Develop process flowcharts for the existing and new system processes, develop methods of resolving process gaps, identify report and data requirements for the...",Kuala Lumpur,,"RM 3,500 - RM 4,500 a month",,IT Integration Business Analyst
3,Idealseed,Malaysia,Develop the data model describing key data elements and how they are to be used. Review applications developed by programmers and analysts to ensure...,Kuala Lumpur,,"RM 5,400 - RM 9,200 a month",,Database Administrator
4,WANNG HARSYS SDN BHD,Malaysia,"Organises the business solution implementation through improvements in information systems, process and procedures, data management, organisation and equipment....",Kuala Lumpur,,,,Business Analyst
5,CompuGroup Medical,Malaysia,"Load, Query, extract and validate data, refresh databases with current data; Ensure data is correct and prepare data loading related reports for our clients;...",Kuala Lumpur,18,,40.8,Application - Analyst/Specialist
6,FTK Solution SB,Malaysia,Ability to analyze and interpret data. Ability to analyze and interpret data and make recommendations. Responsible for compliance with applicable Corporate and...,Kuala Lumpur,,"RM 3,500 - RM 4,000 a month",,Financial Analyst
7,7-Eleven Malaysia Sdn Bhd,Malaysia,"Assist on process, workflow and data analysis to suggest process improvement. Collection and consolidation of required information, and any ad hoc data request...",Kuala Lumpur,,,,Merchandising Analyst
9,Agensi Pekerjaan G&L Sdn. Bhd (G&L Recruitment),Malaysia,"Develop SSIS, analysis and Reports for data analysis requirements on Business Intelligence reporting. Our Client is a Multinational Insurance firm with a...",Subang Jaya,,"RM 2,000 - RM 3,000 a month",,IT Executive/Application Support Analyst/Helpdesk(Fresh Graduates)
0,Timesconsult,Malaysia,"Procurement Support Analyst*. Maintain the procurement related vendor master data, process and forms for the Ariba and other system....",Cyberjaya,,"RM 3,200 a month",,"Procurement Support Analyst @ Global MNC, Cyberjaya"
1,JobHelp,Malaysia,"Level/Path P1 or B3 – Senior Associate / Finance Analyst. Troubleshoot issues with invoices processing, shopping carts, purchaseorders and vendor master data....",Kelana Jaya,,"RM 4,800 a month",,"Senior Finance Associate, P2P - Disbursement"
2,JobHelp,Malaysia,"Finance Analyst 2, P2P, Finance Analyst, P2P. P3 – Senior Analyst. Troubleshoot issues with shopping carts, purchase orders and vendor master data....",Kelana Jaya,,"RM 10,000 a month",,"Senior Analyst, P2P - Purchase to Pay – Purchasing hub"
3,AccountStaff (M) Sdn Bhd,Malaysia,Well versed in relational database design and implementation (MS SQL Server) and SQL query methods for handling voluminous data....,Mid Valley City,,"RM 4,500 - RM 5,500 a month",,System Tester & System Analyst
4,AccountStaff (M) Sdn Bhd,Malaysia,Well versed in relational database design and implementation (MS SQL Server) and SQL query methods for handling voluminous data....,Mid Valley City,,"RM 4,000 - RM 6,000 a month",,System Analyst
